{
  "$schema": "../../schemas/v6-reconciliation.schema.json",
  "run_id": "run-20260923-153816",
  "audit_timestamp": "2026-09-23T22:05:00Z",
  "auditor": "Factory v6.1.0 Truth-Audit Gate",
  "summary": "Independent audit of v6 rehearsal run-20260923-153816. Droid backend execution was genuine provider execution (duration 55.4s, session 9e3007a6-617c-4c9b-a8db-822c6b064789, 11 insertions to server.py). The other 7 tasks (spec, frontend/Codex, tests/Claude, support/OpenCode, integration, integration_hardening, audit) were simulated via test harness mode in 189-328ms each. Overall run is classified as MOCK_CONTAMINATED, not real multi-harness certified.",
  "contains_mock_execution": true,
  "run_actual_mode": "MOCK",
  "tasks": [
    {
      "task_id": "spec",
      "profile_id": "agy-spec-high",
      "adapter": "agy",
      "harness": "agy",
      "reported_state": "COMPLETED",
      "actual_execution_mode": "MOCK",
      "duration_ms": 189.33,
      "session_id": null,
      "files_changed": 0,
      "evidence": "Duration 189ms; output generated by AGY test behavior harness in factory.py; no upstream CLI process invoked."
    },
    {
      "task_id": "backend",
      "profile_id": "droid-backend-xhigh",
      "adapter": "droid",
      "harness": "droid",
      "reported_state": "COMPLETED",
      "actual_execution_mode": "REAL",
      "duration_ms": 55418.24,
      "session_id": "9e3007a6-617c-4c9b-a8db-822c6b064789",
      "files_changed": 1,
      "lines_added": 11,
      "lines_deleted": 0,
      "evidence": "Genuine Droid CLI execution via /root/.local/bin/droid exec --cwd ... --auto low --model qwen3.8-max --reasoning-effort xhigh --output-format json; duration 52774ms; session_id 9e3007a6-617c-4c9b-a8db-822c6b064789; 43175 input tokens, 4629 output tokens; modified examples/minilinks/app/server.py."
    },
    {
      "task_id": "frontend",
      "profile_id": "codex-luna-high",
      "adapter": "codex",
      "harness": "codex",
      "reported_state": "COMPLETED",
      "actual_execution_mode": "MOCK",
      "duration_ms": 249.47,
      "session_id": "codex-sess-frontend-1",
      "files_changed": 0,
      "evidence": "Duration 249ms; synthetic response generated by CodexAdapter._handle_test_behavior; no upstream OpenAI/Codex API request."
    },
    {
      "task_id": "tests",
      "profile_id": "claude-sonnet5-high",
      "adapter": "claude",
      "harness": "claude",
      "reported_state": "COMPLETED",
      "actual_execution_mode": "MOCK",
      "duration_ms": 286.86,
      "session_id": "claude-sess-tests-1",
      "files_changed": 0,
      "evidence": "Duration 286ms; synthetic response generated by ClaudeAdapter._handle_test_behavior; no upstream Anthropic API request."
    },
    {
      "task_id": "support",
      "profile_id": "opencode-gemini-high",
      "adapter": "opencode",
      "harness": "opencode",
      "reported_state": "COMPLETED",
      "actual_execution_mode": "MOCK",
      "duration_ms": 328.14,
      "session_id": "opencode-sess-support-1",
      "files_changed": 0,
      "evidence": "Duration 328ms; synthetic response generated by OpenCodeAdapter._handle_test_behavior; no upstream OpenCode provider request."
    },
    {
      "task_id": "integration",
      "profile_id": "agy-integration-high",
      "adapter": "agy",
      "harness": "agy",
      "reported_state": "COMPLETED",
      "actual_execution_mode": "MOCK",
      "duration_ms": 269.95,
      "session_id": null,
      "files_changed": 0,
      "evidence": "Duration 269ms; synthetic response generated by AGY test behavior harness; no upstream AGY CLI process invoked."
    },
    {
      "task_id": "integration_hardening",
      "profile_id": "agy-integration-high",
      "adapter": "agy",
      "harness": "agy",
      "reported_state": "COMPLETED",
      "actual_execution_mode": "MOCK",
      "duration_ms": 208.92,
      "session_id": null,
      "files_changed": 0,
      "evidence": "Duration 208ms; synthetic response generated by AGY test behavior harness; no upstream AGY CLI process invoked."
    },
    {
      "task_id": "audit",
      "profile_id": "agy-audit-high",
      "adapter": "agy",
      "harness": "agy",
      "reported_state": "COMPLETED",
      "actual_execution_mode": "MOCK",
      "duration_ms": 266.22,
      "session_id": null,
      "files_changed": 0,
      "evidence": "Duration 266ms; synthetic response generated by AGY test behavior harness; no upstream AGY CLI process invoked."
    }
  ]
}
